{
  "version": 1,
  "command_id": "cmd_expired_01",
  "type": "organization.run.step.cancel",
  "issued_at": "2026-08-24T10:00:00Z",
  "expires_at": "2026-08-24T10:10:00Z",
  "device_id": "dev_fixture_01",
  "workspace_id": "wsp_fixture_01",
  "agent_registration_id": "agr_fixture_01",
  "signature": "qvybAwDHloKhNM1DpeIFfvbMuzb0JP7XtOJud0L55z0"
}
