{
  "version": 1,
  "command_id": "cmd_cancel_01",
  "type": "organization.run.step.cancel",
  "issued_at": "2026-08-24T11:59:00Z",
  "expires_at": "2026-08-24T12:01:00Z",
  "device_id": "dev_fixture_01",
  "workspace_id": "wsp_fixture_01",
  "agent_registration_id": "agr_fixture_01",
  "signature": "67n0diVLGJ8v9o5TpolhSuJs9c5aqvGkCqOdIgq1Aqg"
}
